{
  "schema_version": "cocoon.announcements.v1",
  "session_id": "ses_fixture_0001",
  "event_id": "ann_fixture_0001",
  "sequence": 1,
  "type": "alert_started",
  "priority": "high",
  "speech": "Warning: the engine is running and your seatbelt is not fastened. Please fasten your seatbelt.",
  "speakable": true,
  "created_at": "2026-08-24T06:44:01Z",
  "expires_at": "2026-08-24T06:46:01Z",
  "correlation": {
    "alert_id": "ALR-FIXTURE-0001",
    "episode_id": "EPI-FIXTURE-0001",
    "rule_id": "demo.seatbelt_engine_on",
    "rule_version": "0.1.0"
  },
  "provenance": {
    "origin": "simulator",
    "is_simulated": true,
    "observed_at": "2026-08-24T06:44:00Z"
  }
}
